126,"         Look around the country, an abundance you'll find of Mediocre minds. Sift trough the fodder as the sane justice declines because of Mediocre minds. Shrouded under cover, the most flamboyant guise hides a Mediocre mind. You got yours, but you can never bend mine with your Mediocre minds. When they cry foul, you had better watch out  Because you never know which aptitude they're griping about. Don't act too smart for their stenoscopic ways. You'll be discarded away. Reason's not to be what the privileged define with their Mediocre minds. So many sighted people act so helplessly blind from their Mediocre minds. If you want attention, then you will be asked to bend, But the surest insurrection is enlightenment, Then you can live outside inharmoniously without friends and enemies. They wanna keep me locked away 'Cause I'm an overactive brain. Leaders, presidents and the nightly news guys cater to Mediocre minds. Reason's not to be what the privileged define with their Mediocre minds. You got yours, but you can never bend mine with your Mediocre minds. The only natural thing that I despise are The mediocre minds. Mediocre minds, Mediocre minds!        "
127,"         I've spent my life observing and then pondering this place And never has confusion ever ceased. I've also heard a lot of exaltation for our kind And sanctimonious reverence for peace. The stories from our childhood condition us to think That beauty is a basic human trait. But how are they reconciled with daily realities Like poverty and dominance and rape? But you have to be Stone cold dead not to see Overwhelming incongruity, As we search for suggestions to remedy...Mediocrity. [3x] If you just sit back and record what you see, The tragic and exquisite are the same to some degree. But most events depict a common theme: There's far more disorder than there is harmony. I said you've got to be Stone cold dead not to see Overwhelming incongruity, It is pointless to search for teleology. Mediocrity...  (Always mediocrity) [6x]        "
128,"         In 325, the Council devised a set of sacred testaments, transparent and wise. The truth is only ever relied on that which we agree and abide. At the meeting of the minds. Reading of the times. Open the blinds. To our complicated lives. We all need some kind of creed to lead us to light. In old Tennessee, the last century. All scopes were fixed on legal tricks and whether or not we should teach kids natural philosophy, despite uncomfortable verity. At the meeting of the minds. Reading of the times. Open the blinds. To our complicated lives. We all need some kind of creed to lead us to light. There's a beacon that shines in the night, a dark pitch though it may be. And the halcyon fields of opportunity turn out to be consensual and arbitrary. Today on my ride I witnessed a guy complaining about how a so-and-so had lied. No longer will the market decide what the government should provide. At the meeting of the minds. Reading of the times. Open the blinds. To our complicated lives. We all need some kind of creed to lead us to light.        "
129,"         When you're sitting alone, frown and groan Over your bad day, When you're laughing with peers Forget your years, then be on your way. But don't forget, all the while That you've crossed the social mile, And a million days is worth one good laugh. But don't forget, all the while That you've crossed the social mile, And a million days is worth one good laugh.        "
130,"         So proud a history, replete with sanctity, Orbs in their harmony, they sing their code to me. Have you ever heard yourself in the orbit that you are in? The terse, oppressive blanket that's instilled here by our spin. It's misery and famine, it's a force we cannot see, Misery and famine, it compels us naturally. Misery and famine, great ellipse, we bend to thee, misery and famine, just accept your vagrancy. Others who bear no name, who feel that life's a game, My verse they will defame, we suffer all the same. They pay no regard to their position or their speed, But the firmament still covers them with its malevolent seed. It's misery and famine, it's a force we cannot see, Misery and famine, it compels us naturally. Misery and famine, great ellipse, we bend to thee, Misery and famine, just accept your vagrancy. You look for meaning in things no one comprehends, You feel no affinity to the rabble we're in, Sources of inquiry have nothing to portend, They will perplex us all until the coming end, until the coming end. A feeling of despair, hungry and full of care, We resent everywhere the fortune that we share. ""This earth could be a better place"" is a concept I condone, Given our pathetic course our destiny is known. It's misery and famine, it's a force we cannot see, Misery and famine, it compels us naturally. Misery and famine, great ellipse, we bend to thee, Misery and famine, just accept your vagrancy. Misery and famine, Misery and famine, Misery and famine, Misery and famine.        "
131,"         Take those potatoes out of your ears, Listen to the warnings, verify all your fears. There's a world outside that's ready to blow And we're all to blame when it finally explodes! You gotta listen up,  Gotta listen to what they're saying to you, Gotta listen up  And think about what they're telling you. Temperature is risin' from deodorant spray. We'll bury us alive in what we throw away. If we don't reuse most of our debris, our kids can't throw away their carbon for free. You gotta listen up, Gotta think about what I'm telling you, Gotta listen up  And think about what I'm saying to you. They're the modern day catastrophists, They've got practical solutions, They're the self-appointed righteous pragmatists, And they know 50 ways to save the world. What makes you think you can cure our disease? Maybe it's just our biology, Maybe it's time to make room for another species, This is the 21st century! You gotta listen up, Gotta think about what they're saying to you, Gotta listen up  And think about what they're telling you. They're the modern day catastrophists, They know all the right equations, They're the self-appointed righteous pragmatists, And you, too, can be one of the few to save the world! But you gotta listen up, And think about what they're telling you, Gotta listen up  And do exactly what they tell you to. They're the modern day catastrophists, Modern day catastrophists. [7x]        "
132,"         I've got nothing to say,  I've got nothing to do. All of my neurons are functioning smoothly Yet still I'm a cyborg just like you. I am one big myoma that thinks:  My planet supports only me, I've got this one big problem: Will I live forever? I've got just a short time to see. Modern man, evolutionary betrayer, Modern man, ecosystem destroyer. Modern man, destroy yourself in shame, Modern man, pathetic example of earth's organic heritage. When I look back and think, When I ponder and ask ""why?"", I see my ancestors spend with careless abandon, Assuming eternal supply. Modern man, evolutionary betrayer, Modern man, ecosystem destroyer. Modern man, destroy yourself in shame, Modern man, pathetic example of earth's organic heritage. Just a sample of carbon-based wastage, Just a fucking tragic epic of you and I.        "
133,"         If you're discontent to know your world's a pile of shit, Listen to a riddle that'll tickle every bit of it, HA HA HA! Ape shall not murder - Ape wasn't so sure Bad ape you made a mistake, Annihilation in a cannibal war! Well cultivation might have served you Might have raised you up unscathed If you had called that fucker by its name! Did you listen to the arbiter's beck and call? Did you find what you were looking for or not at all? NOT AT ALL! Ape shall not murder - Ape take the cure Bad ape you made a mistake, Annihilation in a cannibal war! Culture might have cured you And raised you up unscathed If you had called that fucker by its name! Say the name! Say the name! Say the name!        "
134,         My head is full of ghosts But I'm no revenant Despite my resident's rivalry And I'll be the faithful pilot On our blind trajectory Do you want to know a secret Will you hold it close and dear This will not be made apparent But you and I are not alone in here My head is full of ghosts No apparition A partition from the host A temple of cognition And forbidden to approach Oh to hell with superstition There's a stranger in the house I don't need no exorcism I need a key And the lock is inside out Now meta-cognition is just intuition And dreamers we'll bark at the moon The weaver's unknown by the loom My head is full of ghosts And I'm the pilot Of ultra-violent ancestry And I'll destroy these passers-by With zest and artistry Ghost! Part apparition A partition from the host A temple of the hidden And unbidden to approach        
135,"         I know a man who doesn't have many friends, I know a place he lives where trouble never ends, I know it's hard for him to read 'tween the lines, And his days are getting so much shorter. He simply turns away and dawns a bitter frown, His world is crumbling, his ship is weighted down, He doesn't care as long as he can wear a crown, I know this man all too well... It's my poor friend me, A portrayal of the great dichotomy. (Great dichotomy) It's my poor friend me And I'm running out of steam. I know there are people who are cynical and vain, They point their finger cuz they can't accept the blame, They live their lives under a blanket of shame And their progeny crawl from underneath it. Lately I've come to see the solution, And it begins with me. But I'm so fallibly human, I've picked the lock but will not turn the key. A people running scared we live, breed and die, All too aware that time is slipping on by, We have solutions but don't even try And I feel I know just who to blame. It's my poor friend me, A reminder of a tragic history. (Tragic history) It's my poor friend me And I'm running out of steam.        "
136,"         Do you know the cost of future misery? Have you lost your sense of sustainability? We are just a step away From realizing what we strive to be, But we've got to break out From this insulated, blind and lame senility. Wake up the new America, wo-oh!Transcend the mass hysteria, wo-oh! Change is the thing you're wary of, wo-oh! We need a new America, wo-oh! Laurels, human triumph,Bestowments from the past, Victories don't mean a thing If they don't last. We are just marching toward extinction With blinders on our eyes, Jeopardizing everything We've learned and come to realize. You call that wise? Open your eyes, America, wo-oh! See through the lies they tell to us, wo-oh! Confront the fears that worry us, wo-oh! We need a new America, wo-oh! We don't have to be afraid to reinvent. We've got to start to build Progress and implement, For when we take our fill And never pay the price, We only build ourselves A fleeting, false paradise. You can live in staunch denial And mark me as your enemy, But I'm just a voice among the throng Who wants a brighter destiny. Then say with me, We are the new America! wo-oh! This is the new America! Wo-oh!        "
137,"         Yeah can you hear the call in our rambling land susurrations,  That can expand beyond all hope of light and plunge us into unrelenting night A pall on truth and reason,  It feels like hunting season So avoid those lines of sight and we'll set this right Welcome to the new dark ages I hope you're living right These are the new dark ages And the world might end tonight Now come ye children one and all - let's heed Ezekiel's call, And bide until the word is good and ripe and get plucked clean out of sight The world will be erased our kin will beImmaculate ejaculate in space Before the king of king's love, he'll snatch us From above, brothers help me sing it Welcome to the new dark ages I hope you're living right These are the new dark ages And the world might end tonight So how do you sleep There's nothing to keep This is deep Because we're animals - with golden rules Who... who can't be moved by rational views Welcome to the new dark ages I hope you're living right Welcome to the new dark ages  And the world might end tonight        "
138,"         When everybody dies around you, from someone else's gun, It really makes you stop and think about the years to come. Something good had to happen to the human race. We all had better stop hoping and set our heads on straight. You've gotta turn over a new leaf, 'cause that old one's turning on you. We've gotta turn over a new leaf. It's the future's only hope or we are doomed. Today is over, it's already shot, so we can think about ourselves. They keep on working on our nature, they're saying that can only help.  Start throwing out your pockets, keep what you really only need. Save life and earth and water, there can't be any other need. You've gotta turn over a new leaf, 'cause that old one's turning on you. You've gotta turn over a new leaf. It's the future's only hope or we are doomed. You've gotta turn over a new leaf, 'cause that old one's turning on you. We've gotta turn over a new leaf. And let your love come on through. You've gotta turn over a new leaf, 'cause that old one's turning on you. We've gotta turn over a new leaf, a new, a new, a new.        "
139,"         Blood is a river, Flowing darkly amidst the tangled roots of the tall shining city, Crazy flowing mantide migrationsEngorge the big ventricle of heartbroken America. So many heaven hoping, hopeful groping breathers All tap together quietly and desperately in unison. Hey, hey, hey, is anybody listening? News from the front, News from the front, We're living in troubled times, So many fighting for their lives, Why do the troops despise the news from the front? Ignorance is the root of fear, And fear is the kindling of anger. War is the bringer of shame, But never has the burden lain so heavily upon the victim. Rage and desolation, Pain and loneliness, Isn't all of it alarmingly familiar? Hey, hey, hey, silence is a killer. News from the front, News from the front, Yeah, these are troubled times, How many more will have to die Before the governors can't deny the news from the front? Break down the barriers, ally the carriers, What is your motivation?  Take a good look in the mirror. News from the front, News from the front, So many are fighting for their lives, How many more will have to die?  Why does the government decry the news from the front?        "
140,"         Culture was the seed of proliferation but it's gotten melded Into an inharmonic whole, to an inharmonic whole. Consciousness has plagued us and we cannot shake it Though we think we're in control, though we think we're in control. Questions that besiege us in life are testament of our helplessness. There's no vestige of a beginning, no prospect of an end. When we all disintegrate it will all happen again, yeah. Time is so rock solid in the minds of the hoards but they can't Explain why it should slip away, explain why it should slip away. History and future are the comforts of our curiosity but here we are Rooted in the present day, rooted in the present day. Questions that besiege us in life are testament of our helplessness. There's no vestige of a beginning, no prospect of an end. When we all disintegrate it will all happen again, yeah. If you came to conquer, you'll be king for a day, But you too will deteriorate and quickly fade away. And believe these words you hear when you think your path is clear... We have no control. We have no control. We have no control, we do not understand. You have no control, you are not in command. You have no control. We have no control. No control. No control. You have no control.        "
141,"         A sullen figure walks along a dusty road,  His life was holy and he couldn't bear the load. He left his people and a simple life behind, He raised his torso and looked into the sky, Shouting his questions, looking for directions. ""What do I do now?"" Now a confused schoolgirl stares at the TV tray, The stresses of maturing compound every day. She glances up to see her favorite video And gets ideas from Madonna's nasty clothes. In need of affection, she craves a direction Her heroes offer her. Everyone's looking for something And they assume somebody else knows what it is. No one can live with the decisions of their own. It seems so they look to someone else To tell them what to do, Tell 'em what to wear, Tell 'em what to say, Tell 'em how to act and think And compel others compulsively  Until the world is all like them. A righteous student came and asked me to reflect, He judged my lifestyle was politically incorrect. I don't believe in self important folks who preach No Bad Religion song can make your life complete. Prepare for rejection, You'll get no direction from me, You'll get no direction from me.        "
142,"         History doesn't make something right, Consensus is not a fact-based exercise. You're tied and bound to this self-indulgent enterprise... We call America. A brush with a star, a token of love, A name in the sand, enough is enough. A diet of air, a face on the net, A fish in your palm, your television set. Once you convince yourself, The universe falls into place. You've got your ideas And your posse of friends, You all make up rules And the fun never ends. But still there's a problem that leaves you gasping for air, You look for some meaning, blank smiles are all that's there, And still water stales a soft summer breeze, You cling to your hopes while you drop to your knees. There's no substance. Once you convince yourself, The universe falls into place. You've got your ideas And your posse of friends, You all make up rules And the fun never ends. But still there's a problem that leaves you gasping for air, You look for some meaning, blank smiles are all that's there, And still water stales a soft summer breeze, You cling to your hopes while you drop to your knees. There's no substance.        "
143,"         Hey mister, don't point at me, You shout rhetoric nonsense like a Pavlovian model Responding to his questions. Hey teacher, arrogance is bliss, You spend your time turning water into life As if you were God's foreman. Is it any wonder Things seem so awry? We swim in a sea of confusion, We don't have to think to survive So nobody listens. Hey recluse, dont shout at me, You proclaim yourself expert by extensions of the methods Detailed in your magazines. Hey downer, don't prey on me, We've all got bum raps that torment us day to day That we hoist on our own shoulders. Is it any wonder People pass you by? Your plea for understanding Is heard as desperate lies? Nobody listens. I can't help you... Is it any wonder Things are so inane? So many quests for compassion Are just for someone's personal gain. So nobody listens to you.        "
144,"         Now, there's a list of catalysts that hold the heart at bay They grip the mind and sap the soul and feed on your dismay And I never understood why you can't see the world this way The lines are drawn at the break of dawn there's nothing to dismay It's no, no, no security No, no no security No, no no security Nothing to dismay The dissonance runs deep in me resort to weak applause Associate and denigrate the root without a cause And just because the overwhelming odds are stacked away What good is should if at most I would? But nothing to dismay It's no, no, no security No, no no security No, no no security Nothing to dismay Well, it's just a solo journey Bewildered and astray But pay no mind to what you find There's nothing to dismay No, no, no, no, no, no, nothing to dismay  No, no, no security nothing to dismay          "
145,"         Presidential election every four years,  But neither man can see or hear,  Urgent cries for society,  But we can see the blood on him,  Do you see?  Do you see it's too much for me?  Try that with our oligarchy,  Try that with our oligarchy!  State the policy to me,  Reap your followers' currency,  What is right, what do we try?  I'm afraid I can't decide.        "
146,"         Transfixated on the big blue screen: Your window to the outside, A melancholy dream, A medium upon which you build reality. This episodic currency, That everybody needs. Somebody's delivery lulls you to sleep. The man behind the weather map, The editor in chief, They control the worlds Of power and disease, And you cannot supress your curiosity. See, it's only entertainment: Superficial urgency, Posterboard mentality. Only entertainment. Tightly constrained, The buzz that remains Is the story of how we run our lives. Hey! Many are the people poor and suffering From the lack of coverage From the transmission beam, And if it ever gets there, You'll be offended too 'Cause you cannot distinguishChicanery from truth. See, it's only entertainment: A superficial episode As life continues to unfold. Only entertainment. Controlled and copied, They've planted the seed That sprouts into your picture of the world. Can't someone protect me (turn away, turn away) From this electron beam? (turn away, turn away) Hey you, Mr. FCC, (turn away, turn away) Have you no advice for me? (turn away...) See, it's only entertainment. Only entertainment, Only entertainment. Unoffical facsimile Leading you to poverty. Only entertainment, Only entertainment, Only entertainment.        "
147,"         Hey, scientist please save us from our rainy days Because your counterpart in the magic art is manufacturing judgment day There's a fell wind blowing out of the east Bringing famine drought and plague Well now at least that's what they say Rain fell like judgment Across my windowpane Said it fell like judgment But it was only rain Well I know what's wrong and I know what's right And I know that evil exists sure as the day turns into night When a man gets down on his knees to pray you know he'll find what he is able But chances are he'll find it either way Rain fell like judgment Across my windowpane Said it fell like judgment But it was only rain Rain fell like judgment Across my windowpane Said it fell like judgment But it was only rain Oh lord, have mercy on a humble man Lost in the wilderness without a guiding hand Rain fell like judgment Across my windowpane Said it fell like judgment But it was only rain It fell like judgment Across my windowpane Said it fell like judgment But it was only rain.        "
148,"         It's an S.O.S. sent out telepathically, Signs of our distress don't allow complacency, We need restoration now of our integrity and a Drastic bold reminder of our morality. The rectifying troop is here, The ones we have needed all these years  To stop the heinous wrongdoings and verify  Our moral benevolence as a people. Operation! Operation rescue, They're here to right our fall, They've heard a troubled call. Operation! Operation rescue, You may wonder where they come from, But I just wonder why they're here at all. Yayayayaya yayayayaya yayayayaya yayayaya. Life ever-after is what they're in business for, See them brandish the key to our kingdom's door. It's persuasive, it's a part of you and me But it's not overwhelming as they wish it to be. If no one believed in fairy tales, There would be nothing they could do but fail. Yet everywhere we look someone is trying to reassure  Our moral benevolence as a people. Operation! Operation rescue, They're here to right our fall, They've heard someone's troubled call. Operation! Operation rescue, You may wonder where they come from, But I just wonder what compels them all. Operation! Operation rescue, Operation! Operation rescue, You may wonder where they come from, But I just wonder what compels them all. Yaya yayaya yaya yayaya yaya yayaya.        "
149,"         Don't wanna have to take your shit anymore I finally concluded that life is way too short The ticking of the hourglass, The tiny grains of sand It beckons me like gravity, Like signposts on the land And you got what you wanted Without force or reprimand The seconds are all running out, This burden's out of hand        "
150,         Instrumental.        
151,"         Sleeping on a time bomb, staring into space, There's an ocean of unpleasantries we are not prepared to face. Sitting on the fence post to watch the storm roll in And terrified of the damage it will bring when it begins. It will begin... Splintered dreams of unity, (Our lives are parallel) So far from reality, (Our lives are parallel) Independent trajectories, (Our lives are parallel) Separate terms of equality. (Our lives are parallel) Our lives are parallel... Is there no redemption? No common good? Is there nothing we can do for ourselves or only what we should? Comes the hard admission of what we don't provide Goes the insistence on the ways and means that so divide. They so divide... Side by side suffering loneliness, (Our lives are parallel) Phony collective progress, (Our lives are parallel) Accepting that it's all such a mess, (Our lives are parallel) Gesturing without hope of redress. (Our lives are parallel) Our lives are parallel... Forging little plays of deception and pain As we watch our foundation crumble away, Staggering like birds against a hurricane And trying all the while to stay out of each other's way. Broken dreams of unity, (Our lives are parallel) Independent trajectories, (Our lives are parallel) Screaming out for understanding, (Our lives are parallel) Turning inward and suffering. (Our lives are parallel) Our lives are parallel...        "
