47,"         Death and the shadow that it casts on life scares me little or none. People tell me of a divine right and the happy chosen one. I'm a freak 'cause my morals clash with others in the world. I go home while they work hard, then they say I'm wrong. There's only one place to be, while living with tragedy. If their sins affected me, I gotta be damned to be free. Freedom is responsibility, pay more than it's worth. Instincts tells us not to die, hazy myth since birth. Learn their rules, play their game, deceive yourself in haste. Turn your own brain into dust; it's not theirs to waste. There's only one place to be, while living with tragedy. Extract the nectar, burn the tree, I gotta be damned to be free. Thinking... This world it ain't so bad. Dying... It's just another fad. Working... 8 hours, that's not for me. Dying... It's just your destiny.        "
48,"         Here's a story of an honest man losing religion, Climbing the pulpit steps before an eager congregation, The while praying came a wicked inspiration, Brothers, sisters this is what he said: Dearly beloved, dearly beloved, dearly beloved,  (Make no mistake, despite our traits, I've seldom seen evidence of genes) I can't relate to you, I can't relate to you! He was the kind of guy who'd always go right out of his way, But more before that crazy notion leapt right into his head, And stubbornly crept into every mad perception, I can't deny a funny feeling when he said: Dearly beloved, dearly beloved, dearly beloved, I can't relate to you, I can't relate to you! Dearest in memoriam - set phasers to stun And grab yourself a neighbors' skeleton to lean upon, Did you know him in life - one filled with regret, So soon we all forget - we ever met, Do you know my name - sing a light refrain For a man estranged - I won't deny that I'm inclined to isolate Dearly beloved, dearly beloved, dearly beloved,  I can't relate to you, I can't relate to you! I can't relate to you, I can't relate to you, I can't relate to you!        "
49,"         Life is the sieve through which my anarchy strains, Resolving itself into works. Chaos is the score upon which reality is written: A timeless, swirling, gyroscopic horde. Seek out! Delirium... delirium... of disorder. Yeah, I am just an atom in an ectoplasmic sea, Without direction or a reason to exist. The anechoic nebula rotating in my brain Is persuading me contritely to persist. Let's go! Delirium of disorder. [x8]        "
50,         Welcome my son to where the work is never done And the hungry are seldom ever fed The department of false hope is a proving ground for dopes And they'll grind your tiny bones to make their bread (Hosanna) So hold your head up high forgotten man Tomorrow won't be made for you And everybody's gotta try to lend a helping hand For god and man there's nothing more to do It crackled on the radio through bright plumes of the sun The announcer said the age of faith was dead Though the adolescent nation was just looking for salvation The beast of reason reared it's ugly head (Hosanna) So hold your head up high forgotten man Tomorrow's not for me and you And everybody's gotta try to lend a helping hand For god and man there's nothing more to do From your cradle of destruction With the poorest of instruction And the merest sliver of a tune You managed somehow to muddle through So hold your head up high forgotten man Tomorrow's not for me and you And everybody's gotta try to lend a helping hand For god and man there's nothing more to do There is nothing more        
51,"         Who do you believe can put some meaning in your life, Meaning in your life, meaning in your life? Who do you conceive to provide you guidance and light, Guidance and light, guidance and light? Are they waiting for you in the by and by? Do you even have to try? Headed for eternity and destined for nothing, The future isn't difficult to see. It's easy to confuse grand design with life's repercussions,Lament not your vanquished fantasy. It's only destiny. Why do you consent to live in ignorance and fear, Ignorance and fear, ignorance and fear? Ancient people succumbed to it, can it happen here, Can it happen here, can it happen here? Does it make you suffer 'cause you have to die? Is it best to live a lie? Headed for eternity and destined for nothing, The future isn't difficult to see. It's easy to confuse grand design with life's repercussions, Lament not your vanquished fantasy. It's only destiny. Why can't you see? There ain't no destiny. For you and me, There ain't no destiny.(Why can't you see?) Why can't you see?(No destiny) (There ain't no destiny) There ain't no destiny.(Why can't you see?) For you and me,(No destiny) (There ain't no destiny) There ain't no destiny! Headed for eternity and destined for nothing, The future isn't difficult to see. It's easy to confuse grand design with life's repercussions, Lament not your vanquished fantasy. It's only destiny.        "
52,         Wasted days and cigarettes Cracked cement and palmsBodhidharma has gone fission With your vedic mom Yeah the Sergeant Major is dreamin' of genie And she's armed with a borrowed polka dot bikini Oh yeah tomorrow's coming down like dharma and the bomb Falling down Falling down like dharma and the bomb Falling down Falling down Like dharma and the bomb The shallows seem evangelical When you're slammed up against a wall And your stoked to watch all creation go over the falls Yeah Kali is coming and you'd better believe it That girl's got the atom and the Bhagavad Gita Oh yeah samsara's coming down like dharma and the bomb Falling down Falling down like Like dharma and the bomb Falling down Falling down like Like dharma and the bomb        
53,"         Hey do what you want, but don't do it around me. Idleness and dissipation breed apathy. I sit on my ass all goddamn day, A misanthropic anthropoid with nothing to Say what you must, do all you can, Break all the fucking rules and Go to Hell with Superman and Die like a champion, yeah hey! Hey I don't know if the billions will survive, But I'll believe in God when 1 and 1 are 5. My moniker is man and I'm rotten to the core. I'll tear down the building just to pass through the door. So do what you must, do all you can, Break all the fucking rules and Go to Hell with Superman and Die like a champion, yeah hey!        "
54,"         See the fight, old men crying, deny their ruin.  Watch them try. The cynic laughs at the optimist's closed eyes. Darkness falls, curtain calls, the cynic's beer soon overflows. Other watches, has a drink, and from the same cup, They drink I'm doin' time, how long I don't know. William had 26, blew his brains out, now look at him. John had only one, watch the mother mourn her only son. I'm doin' time, how long I don't know. I'll kiss goodbye my brain and body And go to sleep for generations. Salvation: Cease concentration. You'll only lose the fight. Don't tell me what's wrong or right! You're losing sight. You're just gonna die anyway!        "
55,"         A grizzly scene on my electron beam Told a story about human rights, So all of king's horses and all of king's men  Had a riot for two days and nights. Well, the city exploded but the gates wouldn't open So the company asked him to quit. Now everybody's equal, Just don't measure it. Well, Hanson did it to Hester And Mark David did it to John. And maybe Jack did it to Marilyn, But he did it to South Vietnam. For beauty and glory, For money, love and country, Now everybody's doing it, Don't do that to me. A bitter debate and a feminine fate Lie in tandem like two precious babes. While the former gets warmer, it's the latter  That matters except on the nation's airwaves. And custodians of public opinion stayed back  After vainly discussing her rights. Lay hands off her body, It's not your fucking life! I don't know what stopped Jesus Christ  From turning every hungry stone into bread. And I don't remember hearing how Moses reacted When the innocent first born sons lay dead. Well, I guess God was a lot more demonstrative Back when he flamboyantly parted the sea. Now everybody's praying, Don't pray on me. Now everybody's praying, Don't prey on me.        "
56,"         We don't need any more mountains Because the trail builders Failed to give us passage there, So we can't reach the sky. We don't need any more failure. There is human tragedy That's written everywhere And we are all too young to die. Like a mystery that's here to stay, Some people never go away Cuz they've got something to say. Don't sell me short! You've been wrong too long. Don't brush me off Just because I don't belong. Like it or not I'm all you've got, Dispose me when I'm shot. Just don't sell me short, I might not be who you thought. We don't need any more fables Because the writers have passed And left us lessonless And we must find our own way. We don't need any more privilege. There is vivid desperation That is powerless That no surplus can repay. Like the fix of rapture in a trance, Oh, fates are sealed by circumstance So you've got to take a chance. Don't sell me short! You've been wrong too long. Don't brush me off Just because I don't belong. Pass me on by, ignore my cry, Forget me when I die. Just don't sell me short, Not while I'm still alive. Everybody's talking  About heaven on earth, I'm still trying to figure  Out just what I'm worth. I'm full of emotion And stuff you can't contain, And you just want to flush me down the drain, But you can't make me go away. Don't sell me short! You've been wrong too long. Don't brush me off Just because I don't belong. Like it or not I'm all you've got, Dispose me when I'm shot. Just don't sell me short, I might not be who you thought. You've been wrong too long. Don't brush me off Just because I don't belong. Pass me on by And forget me when I die Just don't sell me short, Not while I'm still alive.        "
57,"         Heard a word, suicide,  Not from one, but from thousands that tried.  The lawyer's wife and the teenage brat,  One thing in common, they all wanted out.  And it's plain to see.  It goes for you and it goes for me,  And all the screwed up little girls and boys, All thrown in without a choice. But I heard him say, ""I want out,  No complaints and no doubts,  Just a chance to go on."" I heard a word, suicide,  And not from one, but from thousands that died.  Want some attention and a little less regret,  A teenage bluff, little threat. And there are those, there are those who think  That drastic actions will make them unique.  It's really all the same,  That no one's happy and nobody's to blame.  And the moral to this story is old.  It's quite taboo, seldom told.  The seed is reaped before it's sown,  A man's choice is never his own.        "
58,         I had a dream of unity  Where we could work side by side But today I see that it's only me  Just trying to get by Sometimes we strive undeterred To walk as one toward our goal  But as people stray towards more selfish ways We see we have no control I had a dream of unity Where we would work side by side But today I see that it's only me Just tryin' to get by just tryin' to get by        
59,"         The smell of virgin pages wafted through the swinging doors And the croaking speech he'd heard from countless counselors before. They said, ""We all care for you, we know how you suffer, But I know you can succeed, I used to have it so much rougher."" There's hope in the words and emotion in the eyes. It's so easy to be misled by the savvy gentle guise And like fools we trust the delivery, But it's all just drunk sincerity. In maternal family assembly poised regarding the blue tube, The numbers crept up higher and the hawks stayed out of view. Then the generals said, ""We dont want our boys dead. Your sons and your husbands will be coming back heroes soon."" There's hope in the words and emotion in the eyes. It's so easy to be misled by the savvy gentle guise And like fools we trust the delivery, But it's all just drunk sincerity. With steam, heat, and rhythm in the back seat of the car And adolescent perspective projecting life's forecast to the stars, You heard love from the lips and you were rapt by the hips And the promise was eternal, but you couldn't see that far. There's hope in the words and emotion in the eyes. It's so easy to be misled by the savvy gentle guise And like fools we trust the delivery, But it's all just drunk sincerity.        "
60,"         Weak and sick, dying in the sand, no such thing as a promised land.  Don't lose faith in a better life--reincarnation, poor excuse. You're dying you asshole, your religion can't help you now. Dying and starving in the fields you used to plow. Rotting bones in your barren fields.  Worshipped creature's supposed to heal. He won't save you and he won't save me.  See what you want to see. Hindu religion in the mind of a working Joe, Starving and dying in the fields you used to know. You're tied and bound to a god's useless advice. Bloated stomachs from aching diseases hold back the fight. In the end you'll return once more to die again. Go on till you can't no more in non-eternal sin.        "
61,"         Everwhere you looked there was confusion, violence, drama and drugs, So many righteous revolutionaries spouting utopian love, Everyone shrouded in purple haze, Then one day they woke up from their dream state. They found themselves no more at peace than before, Older, meek, and conformed. Empty causes, A bluster for the soul, a fix for their mind. Empty causes, Cling to everything you find. Well, the shots rang out like popcorn And the Chief was hit and rushed out of sight, The mohawk-chain leather brigade rejoiced maliciously on that night. Someone cried out ""fuck the government"", His mates couldn't define what he meant So no one gave him the time of day And the scene died away. Empty causes, A war for the body, an army in the mind. Empty causes, Losing steam as time goes by. Could it be that everybody selfishly desires their own personal retinue And that causes are just manifestations Of too much time and far too little to do. Empty causes, Direction for the soul, conviction for the mind. Empty causes, Cling to everything you find. Empty causes, You've got yours and I've got mine.        "
62,"         Random blobs of power expressed as that which we all disregard, Ordered states of nature on a scale that no one thinks about. Don't speak to me of anarchy of peace or calm revolt, Man, we're in a play of slow decay orchestrated by Boltzmann. It's entropy, it's not a human issue, Entropy, it's a matter of course. Entropy, energy at all levels, Entropy, from it you can not divorce. And your pathetic moans of suffrage tend to lose all significance. Extinction, degradation: The natural outcomes of our ordered lives. Power, motivation: Temporary fixtures for which we strive. Something in our synapses assures us we're ok, But in our disequilibrium we simply can not stay. It's entropy, it's not a human issue, Entropy, it's a matter of course. Entropy, energy at all levels, Entropy, from it you can not divorce. A stolid proposition from a man unkempt as I, My affectatious nature I can not rectify, But we are out of equilibrium unnaturally, A pang of consciousness of death And then you will agree. It's entropy. Entropy, it's a matter of course. Entropy, energy at all levels, Entropy, from it you can not divorce. Entropy, Entropy, Entropy, Entropy!        "
63,"         A new age of reason, Brain treason to trick the mind. What good is searching If nothing's there to find? We arrive at this place Of no return, my brothers, Only to discover that our minds have led us away  So far from the painful truth  Of who we are. What's right is wrong, What's come has gone, What's clear and pure is not so sure.(It came to me.) All promises become a lie, All that's benign corrupts in time,(The fallacy) Of Epiphany. Come forth, bear witness, See the profit from your loss. Beg for forgiveness Only after you tally the cost. We arrive at this place Of no return, my sisters, Only to discover that our values ran us aground On the shoal in the sea of what We could be. What's right is wrong, What's come has gone, What's clear and pure is not so sure.(It came to me.) All promises become a lie, All that's benign corrupts in time,(The fallacy) Of Epiphany. If it's real for me, do I have to prove it to you? Why do revelations fade to cold blue untruths? It's oh so relative,Subservient in total to one's perspective. What's right is wrong, What's come has gone, What's clear and pure is not so sure. (It came to me.) All promises become a lie, All that's benign corrupts in time, (Mountains don't stand the test of time) (The fallacy) Of Epiphany. Oh, always been in me.          "
64,"         She came from Heaven, well, there's no point belaboring that, I've seen some trouble and I must admit that I'm in demand. I confront rejection with magnetic good intentions and yet, Hey Jack, get back, in fact, don't do that. I act sharp but feel uncertain 'Cause next time it could be curtains. Evangeline, Conspirator so fine, Lend me your faith because mine is broken. Compared to mine, What is your crime, Evangeline? Now just to be certain, let's be sure to set the record straight, I could use an angel, but I don't intend to split up the take. Never go for treason, but I got reasons that don't warrant debate, My act's intact and in fact, you're not all that. You act sure but you're uncertain 'Cause next time it could be curtains. Evangeline, Conspirator so fine, Lend me your faith because mine is broken. Compared to mine, What is your crime, Evangeline? Well, there's no use turning back. It's already much too late When the house is burning. Evangeline, Conspirator so fine, Lend me your faith because  mine is broken. Compared to mine, What is your crime, Evangeline?        "
65,"         Well I'm coming home to Gypsy I never thought it'd be so cruel Her big sweet eyes and body are enough to make me drool And when she wraps her arms around me, I just want to melt inside And then she whispers in my ear, boy, I tell ya what she really likes But don't be deceived by my wife Now I'm stuck here all the time, it's a lonely life Yeah, and every day, every day, every day, it's just the same Every day, every way, and every day, it's the same ol' game Every day, and every day, and every day, it's just the same Every day, every day, every day, it's the same ol' game Well next week there's an auction for everybody in the town And Gypsy's got the best hand, smoothest fingers all around I'll put her up for auction, and then be free once more I'll have her bags awaiting on the steps next to the door But don't be deceived by my wife Yeah, I'm stuck here all the time; it's a lonely life Yeah, and every day, every day, and every day, it's just the same Every day, every way, and every day, it's the same ol' game Every day, every day, every day, it's just the same Every day, every day, every day, it's the same ol' thing Every day, every day, every day, it's just the same Every day, every way, every day, it's the same ol' game And every day, and every day, and every day, and every day Every day, and every day, and every day, and every day        "
66,"         Heard a sermon from a creaky pulpit with no one in the nave. I paid a visit to the synagogue and I left there feeling blame. No one can tell me what to do; They had not the capacity to answer me. What the world needs now is some answers to our problems. We can't buy more time because our tender isn't valid. If your soul needs love, you can get consoled by pity, But it looks as though faith alone won't sustain us no more. Watched the scientists throw up their hands conceding, ""Progress will resolve it all."" Saw the manufacturers of Earth's debris ignore another Green Peace call. No one could tell me what to do; No one had the ability to answer me. What the world needs now is some accountability. We can't buy more time 'cause time won't accept our money. If your soul needs love, you can always have my pity, But it looks as though faith alone won't sustain us no more. What the world needs now is some answers to our problems. We can't buy more time 'cause our tender isn't valid. What the world needs now is some accountability. If your soul needs love, you can get consoled by pity, But faith alone won't sustain us anymore. Faith alone won't sustain us anymore... [repeat and fade]        "
67,"         It's all right to have faith in god, But when you bend to their rules and their fucking lies That's when I start to have pity on you. You're living on a mound of dirt, But you can't explain your reason for existence So you blame it on god. So much hatred in this world and you can't decide Who's pulling the strings So you figure it's god. Your whole life foreshadows death And you finally realize you don't want to die alone So you'll always have god. It's all right to have faith in god, But when you bend to their rules and their fucking lies That's when I start to have pity on you. It's all right to have faith in god, But when you bend to their rules and their fucking lies That's when I start to have pity on you. There's people in the world today Who say they're Jewish, Christian and such, They're all ignorant fools. They'll tell you you can't have your own way unless you pay money and dedicate your life Or you'll be damned in hell. Don't be feeble like all of them, You have your own brain full of thoughts and choices, So use it don't let them use you. It's all right to have faith in god, But when you bend to their rules and their fucking lies That's when I start to have pity on you.        "
68,"         Come and see the brilliant light,  Don't let your emotions mask your sight, It's the manifestation of a deeper fight That affects me and you. My optimism was running high, A new world order was on my mind, But I couldn't believe it when I heard them say They're blowing it away. And the fertile crescent is burning today And baby, my emotions are too. The cradle of humanity has led us all astray And we're all in this together, don't you know, 'Cause our species has nowhere else to go. Aggression rears it's ugly head, Retaliation brings further dread, The two are linked by unseen threads That wind back through time. I don't agree with this outdated trend, Nationalism is an evil friend, But hatred is instilled by invisible lines Drawn in our minds. And the fertile crescent is burning today And baby, my emotions are too. The cradle of humanity has led us all astray And we're all in this together, don't you know, 'Cause our species has nowhere else to go.        "
69,"         In the garden where he was cast out by the lord Flames an Omni-directional sword For he as ever failed to gather up the fruit And thus was banished with his loot He cantered aimlessly through endless permutations of night Seeking a purpose and the meaning of kin And when it finally came to him You could've mistook it for the meaning of sin The women wish him well Every time he cast off marching to hell Now if you've never seen a terrible sight Stroll the garden of earthly delight Maybe we can make it right - someday I'll see you high above the Fields of Mars He knelt down before the unholy mob - who cried ""War is god!"" Gleaming outwardly with great pride - and Prepared to die The women wish him well Every time he cast off marching to hell Now if you've never seen a terrible sight Stroll the garden of earthly delight Maybe we can make it right - someday I'll see you high above the Fields of Mars Who cannot fight anymore Will never love any less That kid inside of murder Must be committed To live a life of hostility Never asking what it means When mother nation Blood and religion Sanction killing upon the Fields of Mars High above the Fields of Mars        "
70,"         In a quantity of light, you can search for all of your life but it's finite. From a sudden burst of sound, the recoil may never be found but it is finite (finite but incalculable). On and on, on and on, but impervious to calculation, on and on. It's impervious to calculation.  Woah, just how far it goes, nobody knows. In the peaceful warm embrace, the intention shows on your face, but it's finite. From the hate that spurs us on, to the meek and gullible pawn, it is finite (finite but incalculable). On and on, on and on, but impervious to calculation, on and on. It's impervious to calculation. Woah just how far it goes... Where the lightning sparked a flash, when precisely did it pass? All delusions went away, as with all the shades of gray. Now I'm left with faulty tools and a hazy set of rules and a brand new day. In the turbulent conscious stream,  the unbearable lightness of being, and it's finite. From the universal mass constant matters coming to pass, but it's finite. On and on, on and on, but impervious to calculation, on and on. It's impervious to calculation. woah, just how far it goes, nobody knows. No one knows, woah, no one knows, no one knows.        "
71,"         Lie, lie, lie... The full moon is rising over dark water And the fools below are picking up sticks. And the man in the gallows lies permanently, Waiting for the doctors to come back and tend to him. The flat earth society is meeting here today, Singing happy little lies, And the bright ship humana is sailing far away with grave determination, And no destination. Lie, lie, lie... Yeah, nothing feels better than a spray of clean water And the whistling wind on a calm summer night, but you'd better believe that down in their quarters The men are holding in for their dear lives. The flat earth society is somewhere far away, With their candlesticks and compasses, And the bright ship humana is well on its way With grave determination, And no destination. Lie, lie, lie, ad infinitum...        "
