201,"         You have got your stranglers and prowlers in soft shoes, Furniture makers, carpenters too, Bombers and commandos, all with some lost cause, Disgruntled workers, immersed in ""veritás"". But stealthily, in the land of the free, it's lurking right there: Most are unaware of The biggest killer in American history, And God shed his grace on thee. Business institutions, universities, Both are quite the circus where the killer wants his way. I think of Edward Teller and his moribund reprise, Then I look to Nevada and I can't believe my eyes. It's time for him to die! Most cannot remember minutia learned in school. It's not there on the blackboard, it's what they don't tell you. We have got a problem, it starts and ends right here. It can be defeated, but you've got to face your fear. We'll join and unite and steady our sight, Then we'll put it right 'cause it's time to fight The biggest killer in American history, And God shed his grace on thee.        "
202,"         Do you remember when we were young, adventure had no end? Those were the days my friend. But I’m not talking about that at all. Do you remember when you marred my future with a sickly parasitic pall? That was the day that the earth stalled. That was the day the earth stalled. On the day that the earth stalled. Friction, bonds, and gravity, all harmonic motion ceased. Life itself could not maintain from that singularity. Try to withstand a magnetic storm with no one to keep you warm. Waiting for the rest to fall, since the day that the earth stalled. That was the day the earth stalled. Since the day that the earth stalled. That was the day the earth stalled. On the day that the earth stalled.        "
203,"         Nothing comes easier than madness in the world today, Mass paranoia is a mode, not a malady. Yeah, I'd like to watch a thousand cable channels but there's nothing on, And my high speed connection's monitored daily by the Pentagon. These things are seldom what they seem, I'm not inclined to enjoy my dreams... (Won't go away...) (No peace) No peace, (no friends) no friends,(We trace) We trace the mortal edge (with no defense) To state the obvious: this world is perilous for us. No sense (no sense), no guide (no guide), Ain't it beautiful to be alive? (Yeah, right!) I won't resign before the struggle ends, So I'll construct a sound defense. We are the prey and culture is the predator, I'm running out of time where conditions are positional. Shadows of a doubt cast reluctance and depravity, There's got to be a way to overcome this grim reality. Is there an option left for me? I'm not immune to despondency... (There's no way...) (No peace) No peace, (no friends) no friends,(We trace) We trace the mortal edge (with no defense) To state the obvious: this world is perilous for us. No sense (no sense), no guide (no guide), Ain't it beautiful to be alive? (Yeah, right!) I won't resign before the struggle ends, So I'll construct a sound defense. There's a signpost on the corner And it keeps everybody safe, We were all made in the shade. And your mother's in the kitchen Where she's patching all the cracks in the wall, We never had a care in the world. (No shade) Too much to sacrifice, (no light) it's hard to recognize,(Just black) Traps and compromise (and white) obscuring deadly alibies,(My plans) It's combinational, (and designs) the pressure so intense, So I'll construct this sound defense. (No way) Nothing's plainer than the madness in the world today,(No sign) I must conceal myself and steal myself and break away.(No grace) I seek initiatives in matters that are black and white,(No sense) So I'll construct a sound defense.        "
204,"         Hey angels fall down without warning Cherry lipstick on their teeth and all dangerous curves She had a bullet proof mind and big pawn shop eyes And nothing you could say would get to her So don't look homeward angel from that rumble seat I can strum twice and make it all go away We'll tap every last drop until that beating stops And let the devil come join us dancing Across the yellow sun We'll run Because the devil in stitches only has his fun Performing for the chosen one We can run She was living on the edge of a knife His head was filled with restless ghosts It's so easy to love a bringer of destruction She said, ""Darling I love you madly"" Black tear stained cheeks behind her shattered window Prayin' for a song to save her life I had a paperback crime running straight down my spine So let the devil come join us dancing Across the yellow sun We'll run while devil in stitches goes and has his fun Performing for the chosen one We can run Wild in the street like a formal procession of love and deceit I will carry you home like a bride from the wreckage Here's your punch drunk cupid knocked clean out of his senses I know he drove her out to the brink That's where they stood and looked down Right then he made a decision That's where they made a division Declaring war on the weather A reckless pact with forever So come on and sing Sing hallelujah Right now.        "
205,"         Hey, did you find the pieces your mentor left behind? And did you care, did you trade his genius for your despair? Did you walk the line? Did you see the mongrels on either side? Did greasy fingers grasp for pieces of your mind?        "
206,"         I see a white haired man, he's got a pseudonym He's telling people how they're supposed to live Nobody's listening to the politician No matter what sage advice he has to give He's got a clumsy, outdated m.o. And he's come to a fork in the road And there is only one direction to go Among the commuters, dwarfed by the skyscrapers I watch the countless millions fighting for space See hateful, petty acts, disjointed images, And can't believe that I'm one of the same race We're all just struggling to cope And we come to a fork in the road As we watch our foundations erode There's only one direction to go It's the way of the dodo Such a noble destiny It's the waltz of desperation Passed along to you and me The way of the dodo (It's the gray stuff in your head) (It's the pulse of the living and the voices of the dead)        "
207,"         We strike first And we're unrehearsed. Here we go again To stage the greatest show on heaven and earth. Come on, get your money's worth. Don't wanna live, Don't wanna give, Don't wanna be E-M-P-I-R-E. Don't wanna live, Don't wanna be E-M-P-I-R-E. We're coming on fast And we're built to last. We stumbled once in 'Nam, Now we're glad to finally say Those days have passed. Tell me how long can it last? Don't wanna live, Don't wanna give, Don't wanna be E-M-P-I-R-E. Don't wanna live, Don't wanna be E-M-P-I-R-E. We just started out, You don't need to be afraid, Yeah you deserve two minutes hate. Well, we spit and we cursed And our bleeding hearts burst, But even ten million souls Marching in February couldn't stop the worst. Couldn't reverse... Don't wanna live, Don't wanna give, Don't wanna be E-M-P-I-R-E. Don't wanna live, Don't wanna be E-M-P-I-R-E. I can't live if living is with you...        "
208,"         The silent stray inertia, No burden on my back. No determinance, no ballast, No chance of looking back. It doesn't matter what's ahead, It's time I'll hit it hard. No fixing my position, No sign of retard. It's the fast life, There's nothing I can do. The fast life, Suck it in and follow through. The fast life, Just learning as I go. You might call it careless, But this fast life Is all I've ever known. Like a wispy feather Defying gravity, Or a rolling cobble In the middle of the stream, Propelled by a ghost force That never shows his face, Increase the ante Of this perpetual pace. It's the fast life, There's nothing I can do. The fast life, Suck it in and follow through. The fast life, Just learning as I go. You might call it careless, But this fast life Is all I've ever known. Ever since the day I came out of the womb, My head was always bouncing Off the walls in the room, Always scratching gravel, Covering new ground. No matter how hard they tried, They couldn't pin me down. It's the fast life, There's nothing I can do. The fast life, Suck it in and follow through. The fast life, Just learning as I go. You might call it careless, But this fast life Is all I've ever known. Yeah, it's all I've ever known.        "
209,"         If I could only get the tools, the stimuli and Molecules, frozen moments in time I could be the archetype, a credit to theGenotype, reprogram your mind But the storybook sages fill their pages Hiding from the warming sun Limitless distractions give no pause to distort a  Precious delusion Did you see the moralist retort and raise his fist ""You can't make man a machine!"" I can see the edifice crumbling in foggy mist, Razed by discovery But the storybook sages fill their pages Hiding from the warming sun Limitless distractions give no pause to distort a Precious delusion        "
210,"         The framework of the world is black and white, The infrastructure builders flex their might, Turning true emotion into digital expression: One by one we all fall down. The gray race shrivels, trapped inside, The world it creates is black and white. [2x] The perpetual destructive motion machine Began to chart a course never before seen, Turning raw compassion into fields of plus and minus: One by one we all give in. The gray race shrivels, trapped inside, The world it creates is black and white. [2x] I'd swear there were times when I was someone else, A person with determination and knowledge of the self, But you flattened me to rubble and now I can see  That I'm just faded negative of the image I used to be. Just a shadow. And that's our dilemma.        "
211,"         Every time you shake someone's hand  And it feels like your best friend, Could it be that it's only superficiality? Without regard to well-being, without an inkling of compromise, Handshakes are nothing but a subtle ""fuck you"", Contracts determine the best friendships. This is the way of the modern world, Everyone's vying for patronage, This is the way of the modern world,  And something has gotta give. Every time you shake someone's hand, And you share neither color nor creed, You gotta overcome the obstacles of history. There is restrained passion, mistrust, and bigotry And these have created the new foundations of society, There's no harmony, just class and race. This is the way of the modern world, Everyone's fighting for dominance, This is the way of the modern world, And something has gotta give. Now I believe in unity, and I am willing to compromise, But I'm not gonna lie or sell my soul. Every time you shake someone's hand, It determines where you stand, And if you won't uphold your side then it's better to Fend for yourself, and shun the handshake, Someone's gotta give.        "
212,"         Our Apocalypse 1981, Teenage vagrants lookin' for some fun. A renewed promise of prosperity, A vulgar platform for the world to see. We were... The hippy killers! [4x] Busted refuse from broken homes, Pocked flesh and malacious bones, Creatures sustained by desire, heart and soul, Nothing to leave and nowhere to go. We were... The hippy killers! [4x] Good days during horrible times, Overused bodies, neglected minds, Shoulder to shoulder we formed as one, The next miserable generation. We were... The hippy killers! [4x]        "
213,"         Oh me oh my... Get out of your 1950's fantasy, Your face shines with misery transparently. Spew out that sobering Half-assed victim rhetoric, Make 'em all squirm While they chew on it. It's a secret handshake And a passing wink of the eye As the witches bridge club weekly Meets to pen the tail on the sly. But they never ask: ""Why, oh why, Don't we raise our voices to the sky?"" Instead you're mute and fawn,  Just waiting to die, Like some kind of hopeless housewife. But you can change while you're alive And let 'em all know At least you tried To kill the demons inside. Oh me oh my... Damn your transcendental paralysis, We can work together And make sense of this. Don't be so sure you can chuck it all away, You've got to proceed No matter how bad you want to stay. It's a natural cause  And a comfort zone There in your head. And the world turns away As you tap the snooze button in bed, But nobody can hear a word you said. Your history was never read. Instead you're mute and fawn,  Just waiting to die, Like some kind of hopeless housewife. But you can change while you're alive And let 'em all know At least you tried To kill the demons inside.        "
214,         There's a world outside but I can't really make it There's a life to lead but I can't exactly fake it Yet the mood feels right But my island is sinking out of sight I made jetties so they'd catch all the sediment Removed the rocks and every impediment But the tide's rising high to wash away my island in the night The sheltering sky was to be my everlasting lullaby They said that islands were solid as bedrock Standing firm forevermore But over time even basement wastes away to the unrelenting shore There's a lonely seed waiting to be planted I've instructions but desire is wholly absent I'm just a petrel in the storm My island can't protect me anymore        
215,"         How do you know what you can be If you can't see where you are going? What breaks the silence, misery Can make you see where you belong. It's a dangerous stage, but the show must go on. Why do you lie, why do you lie? Would you betray your soul? Why do you lie, why do you lie? Don't let your weakness show. You just might be the last to know. Freedom is such a loaded word, So full of hurt and such aplomb. Loneliness saunters in its breeze, Like a disease it drags along. The time of your life can't be had for a song. Why do you lie, why do you lie? Would you betray your soul? Why do you lie, why do you lie? Don't let your weakness show. You just might be the last to know. Why do you lie, why do you lie? Would you betray your soul? Why do you lie, why do you lie? Don't let your weakness show. Why do you lie, why do you lie? Only the meek follow. Why do you lie, why do you lie?Trample the fear below. You just might be the last to know.        "
216,"         The quickening is an ephemeral thing That only happens in the dark Like catching lightning in a jar. And the pain that it brings Is just the promise of Spring. It’s madness on the wing. Oh, what does it mean... To come alive? To come alive! To come alive! The entering is soulful conjecturing * Oh lost and by the wind-grieved ghost Come back to me again. Because the way that she bleeds Is in the law that he reads, Confusing words and deeds. So what does it mean... To come alive? To come alive! To come alive! To pierce the vein of the sacred and profane, Poor science in service of a faith, But who will bear the mark of Cain? To come alive? To come alive! To come alive! * Look Homeward Angel from Thomas Wolfe        "
217,"         Seeds of rebellion lay outside your front door. If you nourish them and water them they'll grow into a healthy ""what for?"" And if revolution isn't what's in store, how can you care anymore? It's a dangerous slip, a conscientious shift. In the spirit of resistance you gotta hold your grip Lest the state of your resolve makes you quickly devolve to a  fundamentalist. You're an archetype, they can pin to the wall When you cling to all convictions like a farm animal in its stall, Never thinking of the bigger world outside, as they take you for a ride. It's a dangerous slip, a conscientious shift. In the spirit of resistance you gotta hold your grip. Because passion unabated can be readily conflated as belligerence. It's a dangerous slip, a conscientious shift. The spirit of resistance you gotta hold your grip. And the verdict won't be kind, 'cuz they're desperate for a viable  alternative. Take a stance. The Resist stance.  Take a stance. The Resist stance.  Take a stance. The Resist stance.  Take a stance. The Resist stance!        "
218,"         You want prosperity For yourself, but not for me. Somehow you just can't see We're in this collectively. You think that freedom is A drastic severance From your past relations Just a quest for new bargains. We're not the same person, We're not the same person. Don't even wanna know. Wo-o-oh. Don't need no good advice Nor shoddy merchandise, I'm the suspect device Beaten down, unable to strike. We're not the same person, We're not the same person. Don't even wanna know. Wo-o-oh. And the sun comes over us again, We lament, we pine, and we rescind And we ask for understanding, But aren't we the stingy ones indeed When it's needed from us in the end? We watch the days go by, Compete and then we die. So few ever ask why, But so many just abuse the design. We're not the same person, We're not the same person. Don't even wanna know. Wo-o-oh.        "
219,"         Neighbors, nobody loves you like we do. Neighbors, your government has triumphed in finally making you a public fit for the 21st century.  Never before has a governing body shown so much concern for the economic well-being of its subjects.  Today we have insulated you from countless factions who threathen your financial viability such as the poor; the idealistic foreigners still clinging to their childish notions of social welfare. Why, you're even kept uninformed of useless propagandist journalism that reports alleged violations of human rights (We all know they wouldn't have been punished if they hadn't been doing something wrong!).  And who better to dispense such blantantly evident factoids but a self-appointed authority like myself?  Acid rain is a thing of the past...  Too many possible causes, too little signifigance for our modern thinking public, besides, industrial manufacturing is at an all time low anyway, who needs those narrow minded laborers.  Too many mouths to feed, and to many burden on the pay roll! Who needs 'em here in the land of the free time? Some other ass-backward country will give us what we need by exploiting its uneducated children anyway. The Internet has expanded our ability to pacify average Americans better than ever by offering fantastical adventures to every corner of the imagination. Your home office is the window to your world and the heart of your social life. Such reclusive behavior helps clear the roads and public works from overburden like the lower middle-class and others who depend shamelessly on their government. Today you are freer than ever to do what you want, provided you can pay for it! Remember, the first word in USA is US. We have arrived, neighbors, we are the privileged elite!        "
220,"         Desolate and without purpose, Radiating from so many septic sources, Forming the fabric of a wayward people, Disappearing as the vestiges of our past. Scratched like tartan into virgin soil, A substrate for progress and disarray, A spreading network of broken dreams Searching for a thoroughfare to take us away. Just a little tale from the streets of America, (say a little prayer) Sparkled promises paved with pathos and hysteria, Trenchant, weary native sons, Step back and see the damage done, Meander to the horizon, (shoot straight to the horizon) The streets of America. Black, tarred concrete pine for me Lying dormant for you and country, Hardened surface cracked within Catch the sweat from off of the chin. Of men and women, Senior and child Who look to you and your sterile miles And in their stares is bald dismay For what you promised led them astray. Hard-cracked, daunting, lifeless veins, False hope corridors to greener pastures is all that remains.        "
221,"         Oh yeah! A study of history  Reveals an unflagging appeal to mystery. You talk about abstraction  At the top of the list, But you might as well get pissed,  'Cause in me the essence does not exist. No! Yeah yeah! You’re so shallow. How can your romance hope to be  The veil of an ersatz human nature  That can pacify but never slept well  When there’s the pretension of living a lie? Take me as I am, judge me for my crimes, I can say I’ll behave freely all the time. You can predict what I’ll say, it’s in my DNA, But soon I’ll be a catalogue number anyway. So say a little prayer, Convince yourself that someone cares. All I am is what you see. There is nothing more than the surface of me,  There is nothing more than the surface of me!  You know? Oh yeah! Apologies to Skinner,  But I do believe that I feel like I’m a winner Having just discovered a long solved modal secret  Of how I always feel  So goddamn downtrodden and desperate. Take me as I am, judge me for my crimes, I can say I’ll behave freely all the time. You can predict what I’ll say, it’s in my DNA, But soon I’ll be a catalogue number anyway. So say a little prayer, Convince yourself that someone cares. All I am is what you see. There is nothing more than the surface of me,  There is nothing more than the surface of me!         "
222,"         Catch a shooting star and put it in your pocket Then your pants will start on fire One bird in the hand, or two birds in the bush Neither do you any good, when you're stuck in the quagmire Show everyone you're not sure that they're telling the truth Then you can be known as the universal cynic too Benefit your fellow man with good deeds for the day And you'll serve your life away Pennies saved today are pennies still tomorrow Strewn upon the desk, piled up in the paper weight Show everyone you're not sure that they're telling the truth Then you'll be known as the universal cynic too Wipe your opaque eyes and restore your crystal vision Turn another cheek and exalt in your decision A bit of exercise for the universal cynic in you Early to bed, and early to rise Precludes you from seeing the most brilliant starry nights Sticks and stones can break bones, words can't really hurt Unless you carry guns, and are hungry for a fight Challenging the standards, or questioning the established rules Trying to understand how they can benefit you Showing everyone you're not sure that they're telling the truth Just a bit of exercise for the universal cynic in you; The universal cynic in you        "
223,"         Since the start of the 17th century, There's been the scent of unseasoned wood burning in the air And the conquest of nature meant nothing at all, While we betray exception, we take all that's there. Motives are translucent in the reflection of shame, The actions ghostly remnants of our ancestral ways And unwittingly, you just take your place in this parade. The voracious march of godliness makes us all the same anyway, All the same. Since the dawn of our human family, There's been concentrated sepsis blowing in the breeze And we turned on each other with ferocity, Desperation, forced without reprieve. But the missions were misguided and the trammel led astray, The air resounds with thunder as the victors seized the day And the haunting voice of history lives ignored but not betrayed. The voracious march of godliness will get us close to heaven one day, Some day... The voracious march of godliness makes us all the same anyway, All the same...        "
224,"         You've got to quit your little charade and join the freak parade Now that your road has been paved from conception to your grave. Enormous things to do, others' practices to eschew, To be better than you is impossible to do, But the world won't stop without you. No, the world won't stop without you. Your achievements are unsurpassed, you are highly-ordered mass, But you can bet your ass your free energy will dissipate. Two billion years thus far, now mister here you are, An element in a sea of enthalpic organic compounds. The world won't stop without you. The world won't stop without you. You're only as elegant as your actions let you be A piece of chaos related phylogenetically To every living organ system, we're siblings, don't you see? The earth rotates and will revolve without you constantly. Two billion years thus far, now mister here you are, An element in a sea of enthalpic organic compounds. The world won't stop without you. No, the world won't stop without you. I said the world won't stop without you.        "
225,"         Despite that he saw blatant similarity, He struggled to find a distinctive moiety. All he found was vulgar superficiality, But he focused it to sharpness And shared it with the others. It signified his anger and misery. Them and us, Lobbying determined through a mire of disbelievers, Them and us, Dire perpetuation and incongruous insistence, That there really is a difference Between them and us. Hate is a simple manifestation Of the deep-seated self-directed frustration. All it does is promote fear and consternation. It's the inability To justify the enemy And it fills us all with trepidation. Them and us, Bending the significance to match a whimsied fable, Them and us,Tumult for the ignorant and purpose for the violence, A confused loose alliance forming Them and us. I heard him say We can take them all. But he didn't know who we were And he didn't know who they were. And there wasn't any reason Or motive or value to his story, Just allegory, imitation glory, And a desperate feeble search for a friend. Them and us, Lobbying determined through a mire of disbelievers, Them and us, Dire perpetuation and incongruous insistence, Tumult for the ignorant and purpose for the violence, A confused loose alliance forming Them and us. We can take them all...        "
