0,"         You've given it all you can, And your life is in the garbage can, And you say you're tired and dry, Cuz your mind won't let you cry, So you hang up what is left inside And you want to kiss it all goodbye. You're lost in space, you're swirling ever higher, You're lost on your own, you're too far from home. You're no one's friend, you gave it your best try yeah! You're stuck in the drone, of being alone. You turn to light, but all you get is darkness, Your head turns to stone, your numbness has grown. You're stuck inside your little world of rejects, The good world unknown, you're stuck in the drone.        "
1,"         You were the one, You were my everything. Never apart, No one in-between. Then one day, When you went your own way, You felt justified, And I was mortified. But today... You are just a picture And a thousand memories Is all I take with me 'Cuz your smile Is just too much to see. You're just a thousand memories. Fantasies, broken dreams,Reveries, sordid histories. Following my heart,Laden with reaction Without calibration or design. Committed to a trial, A life of understanding. Can't somebody show a sign to you For me to see if you only knew That you were the one... You were the one, You were my everything. Never apart, No one in-between. Then one day, When you went your own way, You felt justified, And I was mortified. But today... You are just a picture And a thousand memories Is all I take with me 'Cuz a picture is worth One thousand memories.        "
2,"         I heard them say that the meek shall reign on earth,Phantasmal myriads of sane bucolic birth. I've seen the rapture in a starving baby's eyes,Inchoate beatitude, the Lord of the Flies. So what does it mean when your mind starts to stray?Kaleidoscopic images of love on the way. Brother you'd better get down on your knees and pay. 1000 more fools are being born every fucking day. They try to tell me that the lamb is on the way, With microwave transmissions they bombard us every day. The masses are obsequious, contented in their sleep. The vortex of their minds ensconsed within the murky deep. So what does it mean when your mind starts to stray? Kaleidoscopic images of love on the way. Brother you'd better get down on your knees and pay. 1000 more fools are being born every fucking day.        "
3,"         I can't believe it, The way you look sometimes, Like a trampled flag on a city street, Oh yeah. And I don't want it, The things you're offering me, Symbolized bar code, quick ID, Oh yeah. I'm a 21st century digital boy, I don't know how to live But I've got a lot of toys, My daddy is a lazy middle class intellectual, My mommy's on valium, She's so ineffectual, Ain't life a mystery? I can't explain it, The things they're saying to me, It's going yayayayayayaya, Oh yeah. I'm a 21st century digital boy, I don't know how to read But I've got a lot of toys, My daddy is a lazy middle class intellectual, My mommy's on valium, She's so ineffectual, Ain't life a mystery? I tried to tell you about no control, But now I really don't know. And then you told me how bad you had to suffer, Is that really all you have to offer? See I'm a 21st century digital boy, I don't know how to read But I've got a lot of toys, My daddy is a lazy middle class intellectual, My mommy's on valium, She's so ineffectual, Ain't life a mystery? Cat's foot, iron claw, (21st century digital boy) Neurosurgeons scream for more, (21st century digital boy) Innocence raped with napalm fire, (21st century digital boy) Anything I want, I really need. (21st century digital boy) 21st century schitzoid boy, 21st century video boy, 21st century digital boy, 21st century sofa boy...        "
4,         I know I'm part of something greater than myself Don't know the meaning of it but I hope that matters less I don't know anything when I'm factored out of scale I know I'm part of something greater than myself We're all engaging in a game of attrition Maybe god is just a chemical fiction I'm a monkey with a madding affliction With fact checking for a mental condition I know I'm part of something greater than myself Don't know the meaning of it but I hope that matters less I don't know anything when I'm factored out of scale I know I'm part of something greater than myself        
5,"         Well, it was punk-fifteen in the morning And it was time to stand my ground. And as the gawks and stares bombarded me, You know, I didn't even hear a sound. No one gave a damn If I was there or away. If I died and went to hell, They'd throw a party on my grave And they'd all say, ""This kid is just a fool, he'll never be cool. They might as well just ship him off to some other school."" Plain destitute, Just a little too guilty, just a little too soon... That day was just like any other day, No work, and no pay. I knew that paradise was some other place And I'd get there another day. I will find it before I expire 'Cause I've got the desire. Well, it was punk-fifteen in the evening And it was time to set the town on fire. I saw my boots and my hair As reflected in the mirror Reveal a streetkid named desire. I didn't give a damn Because I was just dying to be And as the Hollywood street scene Left its mark on me. I changed from a boy into a man. I said: ""never again!"" I stuck out my chin when I should have ran, Shit in the fan. I was driven so hard By the sound of my heart, But that day was just like any other day, No work, and no pay. I knew that paradise was some other place And I'd get there another day. I will find it before I expire 'Cause I've got the desire. When the walls surround In deeper shades of blue And there's no voice of reason inside you And you search for meaning On an empty shelf, Then you're always dreaming Of somewhere else. Today is just like any other day, No fear, no restraint. I know that paradise is some other place And I will get there another day. You can come with me, No conditions or fares, Somehow, somewhere, I will find it before I expire 'Cause I've got the desire.        "
6,"         I'm going for a walk, Not the after dinner kind, I'm gonna use my hands And I'm gonna use my mind. And who the hell are you to tell me what to do? You can't even tie your own haggard shoes, Your closet is a mess, and your backyard's falling down, And I have no grand ideas or intentions of sticking around. I'm gonna build a world, Independent and exempt, All alone I'll be an empire, With no mortgage and no rent. And I don't need to live in your stinking zoo, You can't even feed the animals donated to you. Your storage sheds are ramshackled, flies decorate the walls, And you expect me to die here in this shit-filled tiny stall? And I know you're watching everything I do, Call me threat to your children, call me socially unglued, Call me master of insanity, unable to relate, Call me lazy, bane, and filthy, Call me monstrous reprobate. I'm going for a walk  And there's nothing you can do, 'cuz I don't have to live like you So I'm going for a walk.        "
7,"         I don't want to live In a world without melody. Sometimes the rhythmic din Of society is too much for me, But purpose is prioritized. These days the goal is win the prize. There's a sleeping resonance we hold Through which we're unified, So let it out!  Don't just get lost in the crowd, No one can deter you from your own path. There's no trip too remote From which you can't come back. And I've got this hunch about you and me, None of us are ready For a world without melody. Melody is the key, It's the surest way To unlock your individuality. Melody is the key, It will set you free! Don't disrelish harmony, Community will make you whole. Work and understanding are the chords Way deep within your soul. They only need to be struck once And the vibrations swell and spread, But if we mute them they decay, Our sensibilities are dead, So let it out!  Don't just be one of the crowd Hesitance and diffidence will do you in And your soul doesn't care For social medicine. And I've got this hunch About you and me, None of us are ready For a world without melody. Melody is the key, It's the surest way To unlock your individuality. Melody is the key, It will set you free! And I know together we could change the world, Just you and me, But I won't live without melody.        "
8,"         See all people in Afghanistan praying to the gods and living in the sand. Somebody’s gonna have to set them free, nobody hears the call or command. But it’s a long way to Harlem, and a long stretch to the king of Siam. And if you don’t have a penny, why should I give a damn? Ad Hominem. You think you’re better than I am? Ad Hominem. You think you’re better than I am. See all the suckers in the handout line living on scraps and they don’t have a dime. Waiting for endless charity devoid of any sense of posterity. Well there’s no Great Depression and there’s no Great Society. And only few go to heaven, all the rest are damned and free. Ad Hominem. You think you’re better than I am? Ad Hominem. You think you’re better than I am. I’m just a soft-cover version of a much harder tale. A walking resemblance of ruts in the trail. Is it possible to divide your ideas and beliefs. Ideas and beliefs. Ideas and beliefs from the people that you don’t like? Ad Hominem. You think you’re better than I am? Ad Hominem. You think you’re better than I am.        "
9,"         Some live, some die,  Everybody wonders why we're here: Should we even try? Philosophers lost in the night. A beacon in the distance, You gotta turn around. Its vestige dimly flickers in elocution sound The modernist's chronometer uptight and underwhelmed,Pretensions of a higher ground. Higher ground... Introspective paradise found. Adam's atoms resound. Economy of nature, The dead and shallow graves, The particles of happiness elude us in remains. A psychosymbiotical reflection on the waves, Eternal as the night and day. Night and day... Omnipresent sealers of fate, Adam's atoms remain. The righteous opposition has led us all astray, One side against the other, one loses, one reclaimed And if reconciliation eludes us everyday, Then will we ever find a way? Find a way... Not with a religionists gaze. Adam's atoms remain. Adam's atoms betray. Adam's atoms remain.        "
10,"         Three thousand miles of wilderness Overcome by the flow. A lonely restitution of pavement,Pomp and show, I seek a thousand answers, I find but one or two, I maintain no discomfiture, My path again renewed. Against the grain, That's where I'll stay. Swimming upstream, I maintain against the grain. Here labeled as a lunatic,Sequestered and content, There ignored and defeated By the government. There's an oriented public Whose magnetic force does pull, But away from the potential of the individual. Against the grain, That's where I'll stay. Swimming upstream, I maintain against the grain. The flow is getting stronger With smaller increments of time. And Eddies of new ideas are  Increasingly hard to find, You need all that the other has, Your right to seize the day, But in all your acquisitions  You will soon be swept away. Against the grain, That's where I'll stay. Swimming upstream, I maintain against the grain. There's a common consensus And an uncomfortable cheer, A reverberating chorus that anyone can hear, It sings ""leave your cares behind you, Just grab tenaciously"", This lulling sense or purpose  Will destroy us rapidly. Against the grain, That's where I'll stay. Swimming upstream, I maintain against the grain.        "
11,"         England Seemed like such a beautiful place from afar, Until one day I saw how miserable things really are. All fantastic images, They only are apparent,Propagated just by hope And desire to share it. Beauty Was the allure that brought me close to you. Loneliness Was the bond that made me stick like glue. All fantastic images, They only are apparent, Promoted by desperate hope That things are somewhere better. I don't have a thing against fantasy, But to chase it down just doesn't make sense to me. If your only hope is simply peace and love, You end up discarding most of what you're made of. All fantastic Images, They only are apparent, Promoted by desperate hope That things are somewhere better.        "
12,"         All good soldiers crack like boulders, The sun climbs up to a razor, violins, New boots and numbers on a chain. All good soldiers... (All good soldiers) Fall in line When they march and shout,(All good soldiers) are a spectacle Marching and singing. Will go anywhere the president says, Because the president believes in God Like all good soldiers should. All good soldiers wait like warheads, When the fighting starts who will be Accountable, a cannibal, a cannonball. All good soldiers, all good soldiers. (All good soldiers) Fall in line When they march and shout,(All good soldiers) are a spectacle Marching and singing. Will go anywhere the president says, Because the president believes in God Like all good soldiers should. It's 6 AM, I can see my breath And the clay dirt is laughing at the weakling boy. Today is the day that I'll write my friends, It's something I've been trying to remember. I had a dream of a wall that was twenty-one stories tall... All... (All good soldiers) Fall in line When they march and shout,(All good soldiers) are a spectacle Marching and singing. Will go anywhere the president says, Because the president believes in God Like all good soldiers should.        "
13,"         This song goes out to all the hopeless sinners With grave allegiances so meaningless and vain, The walking wounded in a pageant of contenders Who balance on a rail of pain for just a pail of rain. And everything is barely mist - blood relations and bricks. My expression, my confession, add it up, extract a lesson More than this, once again, like a bullet as a friend, tell me: Can that be all there is? In my rectory of doubt I kneel to pray like one devout As time the great, gray dreamless sleep of a useless modern God Erodes away each storied day, as wretched Adams with hell to pay Contend upon a rail of pain for just a little rain. And everything is dearly missed - blood relations and bricks My expression, my confession, add it up, extract a lesson More than this, once again, like a bullet as a friend, tell me: Can that be all there is? There’s an endless disposition and it doesn’t mean a god damn thing, There’s space for a paper airplane race in the eye of a hurricane. And if pigs could fly, then surely so could I, But this pedestrian knows better than to even try. My divinity is caught between the colors of a butterfly. And everything is dearly missed - blood relations and bricks My expression, my confession, add it up, extract a lesson More than this, once again, like a bullet as a friend, tell me: Can that be all there is?         "
14,"         I refuse to abuse what is kind to diffuse, But it's there and it's happening to me along the way. As we go through the snow, we cannot forget our foes, But the dinner's always waiting at the table 'long the way, yeah. What you see, not for me, isn't what you planned to be, But you'll have what you wanted in the end along the way. And we'll try as we cry and our brothers pass us by, To be strong through the ages of our tears along the way, yeah. Now we grow as we show that the morals we must know Will be shapen and mistaken by the falls along the way. But forget, don't regret, to find love and happiness Unless you're willing to be strong when they are gone along the way. Like Tommy, you are free, and you will not follow me, Until we see each other once more on the path along the way.        "
15,"         I hate my family, hate my school, speed limits and the golden rule. Hate people who aren't what they seem, more than anything else, American Dream. American Dream's gonna swallow you whole, it's bursting at the seam, It'll sweep you away, so enjoy it today, tomorrow you'll be old thus useless. American Dream... American Dream... American Dream, that's ok, 'cause no one dare give you away. I hate my god, I hate your job, I hate hypocrites and common slobs. Hate people who aren't what they seem, more than anything else, American Dream. Promise me today I'll have a Chevrolet, with whitewalls on the side, One boy, one girl, comfortable lies The American Dream... American Dream... American Dream, that's ok, 'cause no one dare give you away. American Dream! (bleah!)        "
16,"         I don't need to be a global citizen, Because I'm blessed by nationality. I'm a member of a growing populace, We enforce our popularity. There are things that seem to pull us under And there are things that drag us down, But there's a power and a vital presence That's lurking all around. We've got the American Jesus See him on the interstate, We've got the American Jesus He helped build the president's estate. I feel sorry for the earth's population 'cuz so few live in the USA. At least the foreigners can copy our morality, They can visit but they cannot stay. Only precious few can garner our prosperity, It makes us walk with renewed confidence, We've got a place to go when we die And the architect resides right here. We've got the American JesusBolstering national faith, We've got the American Jesus Overwhelming millions every day. He's the farmer's barren fields, (In God) The force the army wields, (We trust) The expressions in the faces of the starving millions. (Because he's one of us) The power up above, (Break down) He's the fuel that drives the clan, (Cave in) He's the motive and the conscience of the murderer. (He can redeem your sins) He's the preacher on TV, (Strong heart) The false sincerity, (Clear mind) The form letters that's written by the big computers. (And infinitely kind) He's the nuclear bombs, (You lose) The kids with no moms (We win) And I'm fearful that he's inside me. (He is our champion!) We've got the American Jesus See him on the interstate. (We've got the American Jesus)We've got the American Jesus Exercising his authority! We've got the American Jesus Bolstering national faith, (We've got the American Jesus) We've got the American Jesus Overwhelming millions every day. One Nation Under God... (ad infinitum)        "
17,"         Everybody is talking about the girl Who went and killed the delivery man, But she looks so kind and gentle, It just doesn't stand to reason. I saw her right there just the other night As stately as a slot machine, But when she looked my way  Something mad as hell came over me, yeah. Anesthesia, Mona Lisa,  I've got a little gun, here comes oblivion. I never loved you, how did you find me? The cops will never prove complicity now. Anna...(1, 2, 3, 4, 5, 6, 7, 8) All good children go to heaven! I remember your face that August night When we lied about the beautiful time to come, And that crazy old man who came much to late And caused a chain reaction. I've been hanging out here for eleven long years Like a church mouse wondering where the cat has gone, And looking at you now is driving me to distraction. Anesthesia, Mona Lisa,  I've got a little gun, here comes oblivion. I never loved you, how did you find me? The cops will never prove complicity now. Anna...(1, 2, 3, 4, 5, 6, 7, 8) All good children go to heaven!        "
18,"         It's a love song to the self, a story recapped every day, It's a world of bogus feelings and a world of slow decay, It's a world of laughter hidden by this world of fear and torment, It's a game of strange compulsion, our visceral convulsion: Anxiety for love of life, anxiety for pain, Anxiety, a feeling that you know you can't contain. Anxiety destroys us but it drives the common man. Foundation of society, anxiety. Suppress it if you can. The caste of coffee achievers didn't perform like they planned. The morning rush hour traffic is our play of false elan. So run around your frantic track and lay you down to sleep; Tomorrow's the redemption, we strive for that exception. Anxiety for love of life, anxiety for pain, Anxiety, a fear that you have nothing more to gain. Anxiety destroys us but it drives the common man. Foundation of society, anxiety. Suppress it if you can. What are we angry for? We all need a common cure. That common goal for which you strive: To have more than the other (have more than the other) guy. The quest for truth, the quest for gold, yeah, we end up all the same. The common lie, the righteous cry, we end up all the same. The angry crowd, those lost and found, everybody's all the same. The poet's pen, these words I lend, we all bend to Anxiety for love of life, anxiety for pain, Anxiety, a feeling that you know you can't contain. Anxiety destroys us but it drives the common man. Foundation of society, anxiety.        "
19,"         What you do is what you are, And wishing upon distant stars Won't improve the hole you're in, Won't absolve your deepest sin. But action is no gift from some covert and lofty God, It's dependant and weighty all the same. And it is oh so easy just to keep to yourself, But then you're at the mercy of imbeciles. Now I didn't make up the rules, But clearly we are led by fools. It is wise to know their ways, So you know how not to behave. But sometimes we find ourselves in desperate need And we look to those with privilege and power. It's then we learn compassion sits inert on their shelves. We're at the mercy of imbeciles. No actions is no gift from some masked spirit in the sky. It's reducible to flesh, mind and bone. And it is oh so easy just to keep to yourself, But then you're at the mercy of imbeciles. Imbeciles! [3x]        "
20,"         Maybe it’s too late for intellectual debate, But a residue of confusion remains. Changing with the times and developmentally tortured minds Are the average citizen’s sources of pain. ""Tell me what we’re fighting for."" I don’t remember anymore, Only temporary reprieve, And the world might cease If we fail to tame the beast. From the faith that you release Comes an atheist peace. Political forces rent Bitter cold winds of discontent And the modern age emerged triumphantly. But now it seems we've stalled And it’s time to de-evolve And relive the dark chapters of history. ""Tell me what we’re fighting for."" No progress ever came from war, Only a false sense of increase, And the world won’t wait For the truth upon a plate, But we’re ready now to feast on an atheist peace.        "
21,"         Everybody wants to dance in a playpen, But nobody wants to play in my garden. I see the hippies on an angry line, Guess they don't get my meaning. I'm enchanted by the birds in my blossoms, I'm enamored by young lovers on the weekend, I like the Fourth of July When bombs start flashing... And I wish I had a shiny red top, A bugle with a big brass bell would cheer me up Or maybe something bigger that could really go pop!  So I could make the gardening stop. Come out to play, come out to play, And we'll pretend it's Christmas Day In my atomic... All my scientists are working on a deadline, So my psychologist is working day and nighttime, They say they know what's best for me. But they don't know what they're doing. And I'm glad I'm not Gorbachev 'Cause I'd wiggle all night Like jelly in a pot. At least he's got a garden with a fertile plot And a party that will never stop. Come out to play, come out to play, And we'll pretend it's Christmas Day In my atomic... I hope there's nothing wrong out there, I'm watching from the room inside my room. Come out to play, come out to play, And we'll pretend it's Christmas Day In my atomic garden!        "
22,"         He's the latest superhero with powers so profound. He can leap a dotted line in just a single bound. I know you must have seen him in books and magazines. He's the quintessential mindless modern epicene. His life is meaningful because he gets things done. Bang bang he's dead, chalk up another triumph for our hero, The Automatic Man. It's true you must have met him, he's your best friend and your foe. His opinions are determined by the status quo. A true creature of habit, he smokes three packs a day. When he has an original thought, he forgets it right away. He's a paradigm of carefree living. He's our mentor, disturb him if you can. He's the answer if your peace of mind is lacking. He's our savior, he is the common man. So if you are troubled by the daily bump and grind, Then take another look around and brother you will find... The Automatic Man.        "
